{
  "$schema": "https://json-schema.org/draft/2020-12/schema",
  "$id": "harness-os-bundle.schema.json",
  "title": "Harness OS bundle (.hos.json)",
  "description": "A portable, storable, swappable package of a harness OS. The bundle is a packaging layer ON TOP of the live .claude/harness-os.json the kernel reads: it wraps the manifest with identity (name@revision), provenance, and an integrity fingerprint, so a designed OS can be exported to a library, shared, version-pinned, diffed, and swapped in and out of a project as one unit. Runtime state (.claude/harness-os.state/) is NEVER part of a bundle — a bundle is a definition, not a running instance. Produced/consumed by the harness-os CLI (export/import/list/use/status).",
  "type": "object",
  "additionalProperties": false,
  "required": ["kind", "bundleVersion", "metadata", "manifest", "fingerprint"],
  "properties": {
    "kind": {
      "description": "Discriminator identifying this file as a harness OS bundle.",
      "const": "harness-os-bundle"
    },
    "bundleVersion": {
      "description": "Envelope format version (distinct from manifest.harnessOsVersion, which is the contract the kernel enforces). A reader refuses envelope versions it does not understand.",
      "const": 1
    },
    "metadata": {
      "type": "object",
      "additionalProperties": false,
      "required": ["name", "revision"],
      "properties": {
        "name": {
          "description": "Stable identifier of this OS, independent of any single project. Together with revision it is the library key (<name>@<revision>.hos.json).",
          "type": "string",
          "pattern": "^[a-z][a-z0-9-]*$",
          "minLength": 1,
          "maxLength": 64
        },
        "revision": {
          "description": "Version of this OS definition. Semver (1.2.0) or a plain integer string. Bumping it on every meaningful change is what makes swaps unambiguous and rollbacks possible.",
          "type": "string",
          "pattern": "^(0|[1-9][0-9]*)(\\.(0|[1-9][0-9]*)){0,2}$"
        },
        "title": {
          "description": "Human-facing name for listings.",
          "type": "string",
          "maxLength": 120
        },
        "description": {
          "type": "string",
          "maxLength": 2000
        },
        "author": {
          "type": "string",
          "maxLength": 200
        },
        "createdAt": {
          "description": "RFC3339 timestamp stamped by the CLI at export.",
          "type": "string",
          "format": "date-time"
        },
        "basedOn": {
          "description": "Lineage: the template or bundle name this OS was derived from, if any.",
          "type": "string",
          "maxLength": 128
        },
        "tags": {
          "type": "array",
          "items": { "type": "string", "maxLength": 40 },
          "maxItems": 32
        }
      }
    },
    "manifest": {
      "description": "The harness OS role manifest itself — the exact document written to .claude/harness-os.json on import. Validated against harness-os.schema.json independently (by the CLI and the fixture linter); embedded here verbatim so a bundle is self-contained. Kept as a plain object here so the two schemas stay decoupled — the manifest contract lives in harness-os.schema.json alone.",
      "type": "object"
    },
    "fingerprint": {
      "description": "Integrity + identity hash of the embedded manifest: 'sha256:' + hex sha256 of the manifest canonicalised as JSON with all object keys sorted recursively and no insignificant whitespace. Recomputed on import and by `status`; a mismatch between this value and the live .claude/harness-os.json means the manifest drifted from the stored bundle. Deterministic across machines.",
      "type": "string",
      "pattern": "^sha256:[0-9a-f]{64}$"
    },
    "notes": {
      "description": "Free-form changelog / design rationale for this revision.",
      "type": "string",
      "maxLength": 8000
    },
    "assets": {
      "description": "Optional companion files shipped with a directory-form bundle (<name>@<rev>/), addressed by relative path — e.g. per-role brief templates the orchestrator pastes into dispatch prompts, or a README. Advisory: the kernel never reads these; they travel with the OS for the humans and orchestrators who operate it.",
      "type": "object",
      "propertyNames": { "pattern": "^[A-Za-z0-9._-]+(/[A-Za-z0-9._-]+)*$" },
      "additionalProperties": {
        "type": "object",
        "additionalProperties": false,
        "required": ["role", "purpose"],
        "properties": {
          "role": { "type": "string", "pattern": "^[a-z][a-z0-9-]*$" },
          "purpose": { "type": "string", "maxLength": 200 }
        }
      }
    }
  }
}
